{
  "id": "cozy",
  "name": {
    "en": "Cozy",
    "ja": "コージー",
    "id": "Hangat"
  },
  "tags": [
    "warm",
    "bloom",
    "vignette"
  ],
  "params": {
    "exposure": 0.1,
    "contrast": 0.08,
    "saturation": 0.05,
    "temperature": 0.25,
    "vignette": 0.25,
    "vignette_soft": 0.6,
    "grain": 0.08,
    "bloom": 0.3,
    "bloom_threshold": 0.75
  }
}
